{
  "schema_version": "1.0.0",
  "passage_id": "psg:eeeeeeeeeeeeeeeeeeeeeeeeeeeeeeeeeeeeeeeeeeeeeeeeeeeeeeeeeeeeeeee",
  "representation_id": "repr:dddddddddddddddddddddddddddddddddddddddddddddddddddddddddddddddd",
  "representation_sha256": "aaaaaaaaaaaaaaaaaaaaaaaaaaaaaaaaaaaaaaaaaaaaaaaaaaaaaaaaaaaaaaaa",
  "work_id": "work:synthetic:shared-offline-control",
  "section_id": "s0",
  "start": 0,
  "end": 16,
  "text_sha256": "aaaaaaaaaaaaaaaaaaaaaaaaaaaaaaaaaaaaaaaaaaaaaaaaaaaaaaaaaaaaaaaa",
  "chunking": {
    "version": "invented-chunk-v1",
    "max_chars": 32,
    "overlap_sentences": 0
  },
  "ordinal": 0,
  "oversized": false
}
